{
  "$schema": "https://rc-silesia.github.io/WEBSITE/schemas/document.v1.json",
  "wersjaSchematu": "1.0.0",
  "dokument": {
    "uri": "uchwala:rcs-silesia/wz/2026-XX-XX/2-zmiana-dewizy",
    "typ": "uchwala",
    "tytul": "Uchwała Nr 2/2026 Walnego Zgromadzenia Członków Rotary Klubu Silesia z dnia _______ 2026 r. w sprawie zmiany dewizy Klubu w § 5 ust. 1 Statutu Rotary Klubu Silesia",
    "tytulSkrocony": "Uchwała B — zmiana dewizy",
    "numerKolejny": "2/2026",
    "organPrzyjmujacy": "wz",
    "dataPrzyjecia": "2026-XX-XX",
    "miejscePrzyjecia": "Mikołów",
    "wersja": "1.0",
    "wersjaPoprzednia": null,
    "status": "projekt",
    "podstawaPrawna": [
      {
        "uri": "statut:rcs-silesia/v1.0",
        "referencja": "§ 18 ust. 2 pkt f",
        "opis": "Uchwalenie zmiany Statutu — wyłączna kompetencja Walnego Zgromadzenia"
      },
      {
        "uri": "statut:rcs-silesia/v1.0",
        "referencja": "§ 18 ust. 8",
        "opis": "Wymóg quorum: 2/3 obecności + bezwzględna większość głosów"
      }
    ],
    "powiazania": [
      {
        "uri": "statut:rcs-silesia/v1.1",
        "relacja": "zmienia",
        "opis": "Zmienia brzmienie dewizy Klubu w § 5 ust. 1 Statutu (zdanie drugie). Przy założeniu uprzedniego podjęcia Uchwały A (korekta redakcyjna), efektem jest Statut wersja 1.2."
      },
      {
        "uri": "statut:rcs-silesia/v1.2",
        "relacja": "jest-poprzedzony",
        "opis": "Statut wersja 1.2 powstaje w wyniku niniejszej uchwały, podjętej po Uchwale A."
      }
    ],
    "danePodmiotu": {
      "nazwa": "Rotary Klub Silesia",
      "KRS": "0001161058",
      "NIP": "6351874727",
      "REGON": "541208196",
      "adres": "ul. Golfowa 2, 43-190 Mikołów"
    }
  },
  "tresc": {
    "typPodzialu": "paragrafy",
    "paragrafy": [
      {
        "id": "p1",
        "numer": "§ 1",
        "referencja": "§ 1",
        "tresc": "W § 5 ust. 1 Statutu Rotary Klubu Silesia zdanie drugie w dotychczasowym brzmieniu „Dewizą Klubu jest hasło „Uczynność innym ponad korzyść własną”.” otrzymuje brzmienie: „Dewizą Klubu jest hasło „Służba ponad własny interes” — będące oficjalnym polskim tłumaczeniem motta Rotary International „Service Above Self”.”"
      },
      {
        "id": "p2",
        "numer": "§ 2",
        "referencja": "§ 2",
        "tresc": "Uzasadnienie zmiany, alternatywne warianty rozważane przed niniejszą uchwałą oraz analizę konsekwencji komunikacyjnych zawiera Załącznik nr 2 do niniejszej Uchwały."
      },
      {
        "id": "p3",
        "numer": "§ 3",
        "referencja": "§ 3",
        "tresc": "Wykonanie uchwały powierza się Zarządowi Klubu, który jest zobowiązany do:",
        "punkty": [
          {
            "id": "p3-pkta",
            "oznaczenie": "a",
            "referencja": "§ 3 pkt a",
            "tresc": "sporządzenia tekstu jednolitego Statutu uwzględniającego niniejszą zmianę (oraz ewentualnie zmiany wynikające z Uchwały Nr ___/2026 w sprawie korekty redakcyjnej, jeżeli została podjęta) — w terminie 14 dni od daty podjęcia uchwały;"
          },
          {
            "id": "p3-pktb",
            "oznaczenie": "b",
            "referencja": "§ 3 pkt b",
            "tresc": "złożenia wniosku do Krajowego Rejestru Sądowego o wpis zmian Statutu — w terminie 7 dni od sporządzenia tekstu jednolitego, zgodnie z art. 21 ustawy z dnia 7 kwietnia 1989 r. Prawo o stowarzyszeniach;"
          },
          {
            "id": "p3-pktc",
            "oznaczenie": "c",
            "referencja": "§ 3 pkt c",
            "tresc": "zaktualizowania wszystkich materiałów Klubu (strona internetowa, komunikacja, materiały promocyjne, dokumenty wewnętrzne) tak, aby konsekwentnie używały nowej dewizy w komunikacji oficjalnej."
          }
        ]
      },
      {
        "id": "p4",
        "numer": "§ 4",
        "referencja": "§ 4",
        "tresc": "Uchwała wchodzi w życie z dniem prawomocnego wpisu zmiany Statutu do Krajowego Rejestru Sądowego."
      }
    ]
  },
  "metadane": {
    "dataWprowadzeniaDoSoT": "2026-05-30",
    "autorWpisu": "audytor strony RC Silesia",
    "uwagiTechniczne": "Konwersja dokumentu Uchwała B (zmiana dewizy § 5 ust. 1) do formatu SoT. (1) Numer porządkowy 2/2026 zakłada, że uchwała głosowana jest jako pkt 2 porządku WZ, po Uchwale A — w źródle numer to placeholder „Nr ___/2026”. (2) Łańcuch wersji modelowany sekwencyjnie: A zmienia v1.0→v1.1, B zmienia v1.1→v1.2; formalnie obie uchwały są od siebie niezależne (B może zostać podjęta bez A — § 3 pkt a tej uchwały zawiera klauzulę warunkową), lecz statut.json odzwierciedla stan po obu (v1.2). Jeżeli WZ podejmie wyłącznie B, wynikiem będzie inny wariant pośredni do przenumerowania przy tekście jednolitym. (3) podstawaPrawna wskazuje statut:rcs-silesia/v1.0 (statut w mocy w dniu WZ, zgodnie z brzmieniem źródła „Statutu z dnia 23 listopada 2024 r.”) — wersja historyczna nieobecna w aktywnym rejestrze, walidacja podstawy prawnej zwróci ją jako brakującą zgodnie z założeniem standardu (walidacja nie wymusza obecności). (4) Załącznik nr 2 (analiza dewizy) jest dokumentem argumentacyjnym, nienormatywnym — nie jest migrowany do SoT, analogicznie do Załącznika nr 1 przy Uchwale A."
  }
}
