{
  "$schema": "https://rc-silesia.github.io/WEBSITE/schemas/document.v1.json",
  "wersjaSchematu": "1.0.0",
  "dokument": {
    "uri": "uchwala:rcs-silesia/wz/2026-XX-XX/1-korekta-redakcyjna",
    "typ": "uchwala",
    "tytul": "Uchwała Nr 1/2026 Walnego Zgromadzenia Członków Rotary Klubu Silesia z dnia _______ 2026 r. w sprawie zmiany Statutu Rotary Klubu Silesia — korekta redakcyjna",
    "tytulSkrocony": "Uchwała A — korekta redakcyjna Statutu",
    "numerKolejny": "1/2026",
    "organPrzyjmujacy": "wz",
    "dataPrzyjecia": "2026-XX-XX",
    "miejscePrzyjecia": "Mikołów",
    "wersja": "1.0",
    "wersjaPoprzednia": null,
    "status": "projekt",
    "podstawaPrawna": [
      {
        "uri": "statut:rcs-silesia/v1.0",
        "referencja": "§ 18 ust. 2 pkt f",
        "opis": "Uchwalenie zmiany Statutu — wyłączna kompetencja Walnego Zgromadzenia"
      },
      {
        "uri": "statut:rcs-silesia/v1.0",
        "referencja": "§ 18 ust. 8",
        "opis": "Wymóg quorum: 2/3 obecności + bezwzględna większość głosów"
      }
    ],
    "powiazania": [
      {
        "uri": "statut:rcs-silesia/v1.0",
        "relacja": "zmienia",
        "opis": "Wprowadza 29 zmian redakcyjnych do Statutu wersja 1.0 — efektem jest Statut wersja 1.1"
      },
      {
        "uri": "statut:rcs-silesia/v1.1",
        "relacja": "jest-poprzedzony",
        "opis": "Statut wersja 1.1 powstaje w wyniku niniejszej uchwały"
      }
    ],
    "danePodmiotu": {
      "nazwa": "Rotary Klub Silesia",
      "KRS": "0001161058",
      "NIP": "6351874727",
      "REGON": "541208196",
      "adres": "ul. Golfowa 2, 43-190 Mikołów"
    }
  },
  "tresc": {
    "typPodzialu": "paragrafy",
    "paragrafy": [
      {
        "id": "p1",
        "numer": "§ 1",
        "referencja": "§ 1",
        "tresc": "Walne Zgromadzenie Członków stwierdza, że niniejsza uchwała ma na celu wyłącznie korektę redakcyjną Statutu Rotary Klubu Silesia uchwalonego dnia 23 listopada 2024 r. — usunięcie literówek, błędów gramatycznych, interpunkcyjnych, typograficznych oraz nieprawidłowości w numeracji artykułów. Uchwała nie zmienia merytorycznej treści Statutu ani intencji jego autorów."
      },
      {
        "id": "p2",
        "numer": "§ 2",
        "referencja": "§ 2",
        "ustepy": [
          {
            "id": "p2-u1",
            "referencja": "§ 2 ust. 1",
            "tresc": "W Statucie Rotary Klubu Silesia wprowadza się 29 zmian redakcyjnych, zgodnie z wykazem stanowiącym Załącznik nr 1 do niniejszej Uchwały."
          },
          {
            "id": "p2-u2",
            "referencja": "§ 2 ust. 2",
            "tresc": "Zmiany obejmują następujące kategorie:",
            "punkty": [
              {
                "id": "p2-u2-pkta",
                "oznaczenie": "a",
                "referencja": "§ 2 ust. 2 pkt a",
                "tresc": "literówki — 4 zmiany (poz. 4, 11, 13, 21 załącznika);"
              },
              {
                "id": "p2-u2-pktb",
                "oznaczenie": "b",
                "referencja": "§ 2 ust. 2 pkt b",
                "tresc": "błędy gramatyczne — 7 zmian (poz. 3, 5, 6, 7, 9, 14, 20);"
              },
              {
                "id": "p2-u2-pktc",
                "oznaczenie": "c",
                "referencja": "§ 2 ust. 2 pkt c",
                "tresc": "interpunkcja — 9 zmian (poz. 1, 2, 8, 10, 12, 15, 16, 17, 18);"
              },
              {
                "id": "p2-u2-pktd",
                "oznaczenie": "d",
                "referencja": "§ 2 ust. 2 pkt d",
                "tresc": "typografia — 1 zmiana (poz. 19);"
              },
              {
                "id": "p2-u2-pkte",
                "oznaczenie": "e",
                "referencja": "§ 2 ust. 2 pkt e",
                "tresc": "numeracja artykułów — 8 zmian (poz. 22-29 — przenumerowanie Artykułów od dawnego VIII do dawnego XV, eliminacja duplikatu „Artykuł VIII”)."
              }
            ]
          }
        ]
      },
      {
        "id": "p3",
        "numer": "§ 3",
        "referencja": "§ 3",
        "tresc": "W odniesieniu do § 18 ust. 9 Statutu, którego brzmienie w obecnym dokumencie jest niekompletne, Walne Zgromadzenie przyjmuje rozstrzygnięcie polegające na dokończeniu ustępu w brzmieniu: „Odwołanie Prezydenta, członków Zarządu Klubu i członków Komisji Rewizyjnej następuje w trybie przewidzianym w ust. 2 pkt a, b, c oraz ust. 4 niniejszego paragrafu” (wariant B)."
      },
      {
        "id": "p4",
        "numer": "§ 4",
        "referencja": "§ 4",
        "ustepy": [
          {
            "id": "p4-u1",
            "referencja": "§ 4 ust. 1",
            "tresc": "Wykonanie uchwały powierza się Zarządowi Klubu, który jest zobowiązany do:",
            "punkty": [
              {
                "id": "p4-u1-pkta",
                "oznaczenie": "a",
                "referencja": "§ 4 ust. 1 pkt a",
                "tresc": "sporządzenia tekstu jednolitego Statutu uwzględniającego zmiany przyjęte niniejszą uchwałą — w terminie 14 dni od daty podjęcia uchwały;"
              },
              {
                "id": "p4-u1-pktb",
                "oznaczenie": "b",
                "referencja": "§ 4 ust. 1 pkt b",
                "tresc": "złożenia wniosku do Krajowego Rejestru Sądowego o wpis zmian Statutu — w terminie 7 dni od sporządzenia tekstu jednolitego, zgodnie z art. 21 ustawy z dnia 7 kwietnia 1989 r. Prawo o stowarzyszeniach;"
              },
              {
                "id": "p4-u1-pktc",
                "oznaczenie": "c",
                "referencja": "§ 4 ust. 1 pkt c",
                "tresc": "opublikowania tekstu jednolitego na stronie internetowej Klubu po uprawomocnieniu się wpisu w KRS."
              }
            ]
          }
        ]
      },
      {
        "id": "p5",
        "numer": "§ 5",
        "referencja": "§ 5",
        "tresc": "Uchwała wchodzi w życie z dniem podjęcia, z tym że w zakresie zmian wymagających wpisu do Krajowego Rejestru Sądowego — z dniem prawomocnego wpisu do KRS."
      }
    ]
  },
  "metadane": {
    "dataWprowadzeniaDoSoT": "2026-05-30",
    "autorWpisu": "audytor strony RC Silesia",
    "uwagiTechniczne": "Treść uchwały — wariant z przyjętym wariantem B dla § 18 ust. 9. W przypadku wyboru wariantu A przez WZ, § 3 niniejszej uchwały otrzymuje inne brzmienie (skreślenie § 18 ust. 9 Statutu)."
  }
}